{
  "$schema": "http://json-schema.org/draft-07/schema#",
  "title": "MovieReview",
  "type": "object",
  "properties": {
    "review_id": {
      "type": "string",
      "description": "Unique identifier for the review, typically a UUID."
    },
    "movie_title": {
      "type": "string",
      "description": "Title of the movie being reviewed."
    },
    "reviewer_name": {
      "type": "string",
      "description": "Name of the person who wrote the review."
    },
    "rating": {
      "type": "number",
      "minimum": 0,
      "maximum": 10,
      "description": "Rating given to the movie, on a scale from 0 to 10."
    },
    "review_text": {
      "type": "string",
      "description": "Text content of the review."
    }
  },
  "required": [
    "review_id",
    "movie_title",
    "reviewer_name",
    "rating",
    "review_text"
  ]
}
