[
  {
    "review_id": "550e8400-e29b-41d4-a716-446655440000",
    "movie_title": "Echoes of Eternity",
    "reviewer_name": "Elena Rodriguez",
    "rating": 8.5,
    "review_text": "A mesmerizing cinematic journey that explores the depths of human emotion and the complexity of time. The cinematography is breathtaking, and the performances are nuanced and compelling."
  },
  {
    "review_id": "550e8400-e29b-41d4-a716-446655440001",
    "movie_title": "Quantum Horizon",
    "reviewer_name": "Marcus Chen",
    "rating": 7.9,
    "review_text": "An intriguing sci-fi thriller that pushes the boundaries of scientific imagination. While the plot can be complex, the visual effects and thought-provoking narrative make it a must-watch."
  },
  {
    "review_id": "550e8400-e29b-41d4-a716-446655440002",
    "movie_title": "Silent Whispers",
    "reviewer_name": "Aisha Patel",
    "rating": 9.2,
    "review_text": "A deeply moving drama that captures the subtle nuances of human relationships. The lead actors deliver powerful, understated performances that will stay with you long after the credits roll."
  },
  {
    "review_id": "550e8400-e29b-41d4-a716-446655440003",
    "movie_title": "Urban Legends: Reborn",
    "reviewer_name": "Jake Thompson",
    "rating": 6.7,
    "review_text": "An entertaining horror remake that offers some fresh twists on classic urban myths. While not groundbreaking, it provides solid scares and engaging suspense for genre fans."
  },
  {
    "review_id": "550e8400-e29b-41d4-a716-446655440004",
    "movie_title": "Culinary Secrets",
    "reviewer_name": "Sophie Laurent",
    "rating": 8.1,
    "review_text": "A delightful documentary that explores the hidden world of international cuisine. Beautifully shot and filled with passionate stories of chefs and their culinary traditions."
  },
  {
    "review_id": "550e8400-e29b-41d4-a716-446655440005",
    "movie_title": "Midnight Crossroads",
    "reviewer_name": "David Kim",
    "rating": 7.5,
    "review_text": "A noir-inspired thriller that keeps you guessing until the very end. Strong performances and atmospheric cinematography elevate this intricate crime drama."
  },
  {
    "review_id": "550e8400-e29b-41d4-a716-446655440006",
    "movie_title": "Celestial Symphony",
    "reviewer_name": "Isabella Morales",
    "rating": 9,
    "review_text": "An extraordinary musical documentary that explores the universal language of music across different cultures. Deeply moving and intellectually stimulating."
  },
  {
    "review_id": "550e8400-e29b-41d4-a716-446655440007",
    "movie_title": "Forgotten Memories",
    "reviewer_name": "Ryan O'Connor",
    "rating": 7.3,
    "review_text": "A psychological drama that delves into the fragility of memory and identity. Compelling performances and a non-linear narrative keep the audience engaged."
  },
  {
    "review_id": "550e8400-e29b-41d4-a716-446655440008",
    "movie_title": "Techno Revolution",
    "reviewer_name": "Emma Watson",
    "rating": 8.7,
    "review_text": "An insightful documentary about the transformative power of technology in modern society. Balanced, thought-provoking, and incredibly relevant."
  },
  {
    "review_id": "550e8400-e29b-41d4-a716-446655440009",
    "movie_title": "Wilderness Calling",
    "reviewer_name": "Carlos Fernandez",
    "rating": 8.3,
    "review_text": "A stunning nature documentary that captures the raw beauty and fragility of our planet's ecosystems. Breathtaking cinematography and a powerful environmental message."
  },
  {
    "review_id": "550e8400-e29b-41d4-a716-446655440010",
    "movie_title": "Echoes of Infinity",
    "reviewer_name": "Elena Martinez",
    "rating": 8.7,
    "review_text": "A captivating cinematic exploration that transcends traditional storytelling. The intricate narrative weaves through time and emotion, creating a profound and immersive experience."
  },
  {
    "review_id": "550e8400-e29b-41d4-a716-446655440011",
    "movie_title": "Quantum Nexus",
    "reviewer_name": "Marcus Wong",
    "rating": 8.2,
    "review_text": "A mind-bending sci-fi adventure that challenges our understanding of reality. Stunning visual effects and a cerebral script make this a standout in the genre."
  },
  {
    "review_id": "550e8400-e29b-41d4-a716-446655440012",
    "movie_title": "Whispers in the Wind",
    "reviewer_name": "Aisha Khan",
    "rating": 9,
    "review_text": "An emotionally resonant drama that explores the intricate tapestry of human connections. Subtle yet powerful performances that touch the deepest parts of the soul."
  },
  {
    "review_id": "550e8400-e29b-41d4-a716-446655440013",
    "movie_title": "Urban Myths Unleashed",
    "reviewer_name": "Jake Rodriguez",
    "rating": 7.1,
    "review_text": "A fresh take on contemporary horror that reimagines urban legends with clever twists. Provides genuine scares and unexpected narrative turns."
  },
  {
    "review_id": "550e8400-e29b-41d4-a716-446655440014",
    "movie_title": "Gastronomic Journeys",
    "reviewer_name": "Sophie Chen",
    "rating": 8.4,
    "review_text": "A mouthwatering exploration of global culinary traditions. Beautifully crafted documentary that celebrates the art and passion of cooking across cultures."
  },
  {
    "review_id": "550e8400-e29b-41d4-a716-446655440015",
    "movie_title": "Twilight Intersections",
    "reviewer_name": "David Park",
    "rating": 7.8,
    "review_text": "A gripping noir thriller that masterfully intertwines multiple storylines. Atmospheric cinematography and nuanced performances keep viewers on the edge of their seats."
  },
  {
    "review_id": "550e8400-e29b-41d4-a716-446655440016",
    "movie_title": "Harmonic Cosmos",
    "reviewer_name": "Isabella Rodriguez",
    "rating": 8.9,
    "review_text": "An extraordinary musical journey that explores the profound connections between sound, culture, and human experience. Deeply moving and intellectually stimulating."
  },
  {
    "review_id": "550e8400-e29b-41d4-a716-446655440017",
    "movie_title": "Fragments of Consciousness",
    "reviewer_name": "Ryan Sullivan",
    "rating": 7.6,
    "review_text": "A provocative psychological drama that delves into the complex nature of memory and perception. Innovative storytelling that challenges viewers' understanding of reality."
  },
  {
    "review_id": "550e8400-e29b-41d4-a716-446655440018",
    "movie_title": "Digital Frontier",
    "reviewer_name": "Emma Lee",
    "rating": 8.5,
    "review_text": "A compelling documentary that explores the transformative impact of technology on human society. Balanced, insightful, and incredibly timely."
  },
  {
    "review_id": "550e8400-e29b-41d4-a716-446655440019",
    "movie_title": "Nature's Symphony",
    "reviewer_name": "Carlos Rodriguez",
    "rating": 8.6,
    "review_text": "A breathtaking visual journey through the world's most pristine ecosystems. Stunning cinematography that captures the delicate beauty and urgent conservation needs of our planet."
  },
  {
    "review_id": "550e8400-e29b-41d4-a716-446655440011",
    "movie_title": "Echoes of Eternity",
    "reviewer_name": "Elena Rodriguez",
    "rating": 8.7,
    "review_text": "A captivating cinematic exploration that transcends traditional storytelling. The intricate narrative weaves through time and emotion, creating a profound and immersive experience."
  },
  {
    "review_id": "550e8400-e29b-41d4-a716-446655440012",
    "movie_title": "Quantum Horizon",
    "reviewer_name": "Michael Wong",
    "rating": 8.2,
    "review_text": "A mind-bending sci-fi adventure that challenges our understanding of reality. Stunning visual effects and a cerebral script make this a standout in the genre."
  },
  {
    "review_id": "550e8400-e29b-41d4-a716-446655440013",
    "movie_title": "Echoes in the Wind",
    "reviewer_name": "Zara Khan",
    "rating": 9,
    "review_text": "An emotionally resonant drama that explores the intricate tapestry of human connections. Subtle yet powerful performances that touch the deepest parts of the soul."
  },
  {
    "review_id": "550e8400-e29b-41d4-a716-446655440014",
    "movie_title": "Urban Legends Unmasked",
    "reviewer_name": "Jason Rodriguez",
    "rating": 7.2,
    "review_text": "An innovative exploration of urban legends that offers a unique perspective on contemporary horror. Delivers unexpected narrative surprises and genuine thrills that keep viewers on the edge of their seats."
  },
  {
    "review_id": "550e8400-e29b-41d4-a716-446655440015",
    "movie_title": "Gastronomic Journeys",
    "reviewer_name": "Emily Chen",
    "rating": 8.7,
    "review_text": "A mouthwatering exploration of global culinary traditions. Beautifully crafted documentary that celebrates the art and passion of cooking across cultures."
  },
  {
    "review_id": "550e8400-e29b-41d4-a716-446655440016",
    "movie_title": "Twilight Crossroads",
    "reviewer_name": "David Park",
    "rating": 7.5,
    "review_text": "A gripping noir thriller that masterfully intertwines multiple storylines. Atmospheric cinematography and nuanced performances keep viewers on the edge of their seats."
  },
  {
    "review_id": "550e8400-e29b-41d4-a716-446655440017",
    "movie_title": "Celestial Harmonies",
    "reviewer_name": "Sofia Martinez",
    "rating": 8.9,
    "review_text": "A mesmerizing cinematic exploration that delves into the intricate tapestry of musical expression across different cultures. Emotionally resonant and intellectually engaging, this film offers a profound meditation on the universal language of music."
  },
  {
    "review_id": "550e8400-e29b-41d4-a716-446655440018",
    "movie_title": "Echoes of Consciousness",
    "reviewer_name": "Ryan Sullivan",
    "rating": 7.6,
    "review_text": "An introspective psychological exploration that unravels the intricate layers of memory and subjective experience. Thought-provoking narrative that pushes the boundaries of cinematic perception."
  },
  {